{"$schema":"https://json-schema.org/draft/2020-12/schema","$id":"source.schema.json","title":"Bibliographic source","type":"object","required":["source_id","type","title"],"properties":{"source_id":{"type":"string"},"type":{"enum":["book","article","chapter","database","museum_record","standard","web","other"]},"title":{"type":"string"},"authors":{"type":"array","items":{"type":"string"}},"year":{"type":["integer","null"]},"publisher":{"type":"string"},"doi":{"type":"string"},"isbn":{"type":"string"},"url":{"type":"string"},"rights_note":{"type":"string"},"notes":{"type":"string"}},"additionalProperties":false}
