[
  {
    "source_id": "olivier2007",
    "type": "book",
    "title": "Édition holistique des textes chypro-minoens",
    "authors": [
      "Jean-Pierre Olivier"
    ],
    "year": 2007,
    "rights_note": "Bibliographic reference. No redistribution rights to publication content asserted.",
    "notes": "Major modern edition; future record-level use requires precise locators."
  },
  {
    "source_id": "ferrara2012",
    "type": "book",
    "title": "Cypro-Minoan Inscriptions, Volume 1: Analysis",
    "authors": [
      "Silvia Ferrara"
    ],
    "year": 2012,
    "publisher": "Oxford University Press",
    "rights_note": "Bibliographic reference only; no redistribution rights asserted."
  },
  {
    "source_id": "ferrara2013",
    "type": "book",
    "title": "Cypro-Minoan Inscriptions, Volume 2: The Corpus",
    "authors": [
      "Silvia Ferrara"
    ],
    "year": 2013,
    "publisher": "Oxford University Press",
    "isbn": "9780199693825",
    "rights_note": "Bibliographic reference only; photographs, drawings, editorial text/transcriptions are not presumed redistributable."
  },
  {
    "source_id": "unicode16",
    "type": "standard",
    "title": "The Unicode Standard, Version 16.0, §8.4 Cypro-Minoan",
    "authors": [
      "Unicode Consortium"
    ],
    "year": 2024,
    "url": "https://www.unicode.org/versions/Unicode16.0.0/",
    "rights_note": "External standard; consult Unicode terms of use."
  },
  {
    "source_id": "everson-ferrara-valerio2016",
    "type": "other",
    "title": "Proposal to encode the Cypro-Minoan script in the SMP of the UCS",
    "authors": [
      "Michael Everson",
      "Silvia Ferrara",
      "Miguel Valério"
    ],
    "year": 2016,
    "url": "https://www.unicode.org/L2/L2016/16089-n4715-cyprominoan.pdf",
    "rights_note": "External proposal; cite authors and source."
  },
  {
    "source_id": "louvre-cm-25",
    "type": "museum_record",
    "title": "Louvre Collections: inscribed Cypro-Minoan clay ball (catalogue 25)",
    "authors": [
      "Musée du Louvre"
    ],
    "year": 2025,
    "url": "https://collections.louvre.fr/ark:/53355/cl010131597",
    "rights_note": "Museum catalogue metadata used as an attributed source. No Louvre images redistributed."
  },
  {
    "source_id": "louvre-cm-26",
    "type": "museum_record",
    "title": "Louvre Collections: inscribed Cypro-Minoan clay ball (catalogue 26)",
    "authors": [
      "Musée du Louvre"
    ],
    "year": 2025,
    "url": "https://collections.louvre.fr/ark:/53355/cl010131598",
    "rights_note": "Museum catalogue metadata used as an attributed source. No Louvre images redistributed."
  },
  {
    "source_id": "louvre-cm-27",
    "type": "museum_record",
    "title": "Louvre Collections: inscribed Cypro-Minoan clay ball (catalogue 27)",
    "authors": [
      "Musée du Louvre"
    ],
    "year": 2025,
    "url": "https://collections.louvre.fr/ark:/53355/cl010131602",
    "rights_note": "Museum catalogue metadata used as an attributed source. No Louvre images redistributed."
  },
  {
    "source_id": "louvre-cm-28",
    "type": "museum_record",
    "title": "Louvre Collections: inscribed Cypro-Minoan clay ball (catalogue 28)",
    "authors": [
      "Musée du Louvre"
    ],
    "year": 2025,
    "url": "https://collections.louvre.fr/ark:/53355/cl010131603",
    "rights_note": "Museum catalogue metadata used as an attributed source. No Louvre images redistributed."
  },
  {
    "source_id": "louvre-cm-29",
    "type": "museum_record",
    "title": "Louvre Collections: inscribed Cypro-Minoan clay ball (catalogue 29)",
    "authors": [
      "Musée du Louvre"
    ],
    "year": 2025,
    "url": "https://collections.louvre.fr/ark:/53355/cl010131601",
    "rights_note": "Museum catalogue metadata used as an attributed source. No Louvre images redistributed."
  },
  {
    "source_id": "louvre-cm-30",
    "type": "museum_record",
    "title": "Louvre Collections: inscribed Cypro-Minoan clay ball (catalogue 30)",
    "authors": [
      "Musée du Louvre"
    ],
    "year": 2025,
    "url": "https://collections.louvre.fr/ark:/53355/cl010131604",
    "rights_note": "Museum catalogue metadata used as an attributed source. No Louvre images redistributed."
  },
  {
    "source_id": "louvre-cm-31",
    "type": "museum_record",
    "title": "Musée du Louvre Collections: inscribed Cypro-Minoan clay ball AM 2233",
    "authors": [
      "Musée du Louvre"
    ],
    "year": 2025,
    "url": "https://collections.louvre.fr/ark:/53355/cl010131605",
    "rights_note": "Textual entry reused under Licence Ouverte / Open Licence Etalab; Louvre entry last updated 2025-12-08. No Louvre images redistributed.",
    "notes": "Attribution: Musée du Louvre. Museum entry warns that its contents may not reflect the latest state of knowledge."
  },
  {
    "source_id": "louvre-cm-32",
    "type": "museum_record",
    "title": "Musée du Louvre Collections: inscribed Cypro-Minoan clay ball AM 2235",
    "authors": [
      "Musée du Louvre"
    ],
    "year": 2025,
    "url": "https://collections.louvre.fr/ark:/53355/cl010131607",
    "rights_note": "Textual entry reused under Licence Ouverte / Open Licence Etalab; Louvre entry last updated 2025-12-08. No Louvre images redistributed.",
    "notes": "Attribution: Musée du Louvre. Museum entry warns that its contents may not reflect the latest state of knowledge."
  },
  {
    "source_id": "louvre-cm-33",
    "type": "museum_record",
    "title": "Musée du Louvre Collections: inscribed Cypro-Minoan clay ball AM 2234",
    "authors": [
      "Musée du Louvre"
    ],
    "year": 2025,
    "url": "https://collections.louvre.fr/ark:/53355/cl010131606",
    "rights_note": "Textual entry reused under Licence Ouverte / Open Licence Etalab; Louvre entry last updated 2025-12-08. No Louvre images redistributed.",
    "notes": "Attribution: Musée du Louvre. Museum entry warns that its contents may not reflect the latest state of knowledge."
  },
  {
    "source_id": "louvre-cm-209",
    "type": "museum_record",
    "title": "Musée du Louvre Collections: Cypro-Minoan object AM 2336",
    "authors": [
      "Musée du Louvre"
    ],
    "year": 2026,
    "url": "https://collections.louvre.fr/ark:/53355/cl010131738",
    "rights_note": "Textual collection data reused under Licence Ouverte / Open Licence Etalab; no images redistributed."
  },
  {
    "source_id": "valerio2017",
    "type": "chapter",
    "title": "Script Comparison in the Investigation of Cypro-Minoan",
    "authors": [
      "Miguel Valério"
    ],
    "year": 2017,
    "publisher": "Oxbow Books",
    "url": "https://cris.unibo.it/handle/11585/722704",
    "rights_note": "Bibliographic/abstract-level reference only. No protected tables, figures, or substantial text reproduced."
  },
  {
    "source_id": "valerio2014",
    "type": "article",
    "title": "Seven uncollected Cypro-Minoan inscriptions",
    "authors": [
      "Miguel Valério"
    ],
    "year": 2014,
    "url": "https://doi.org/10.1515/kadmos-2014-0006",
    "rights_note": "Bibliographic and catalogue-control use; article copyright retained."
  },
  {
    "source_id": "davis-maran-wirghova2014",
    "type": "article",
    "title": "A new Cypro-Minoan inscription from Tiryns: TIRY Avas 002",
    "authors": [
      "Brent Davis",
      "Joseph Maran",
      "Soňa Wirghová"
    ],
    "year": 2014,
    "url": "https://doi.org/10.1515/kadmos-2014-0005",
    "rights_note": "Bibliographic/object metadata and attributed factual assertions; no figures redistributed."
  },
  {
    "source_id": "davis-maran-prillwitz-wirghova2023",
    "type": "article",
    "title": "A Canaanite jar with a Cypro-Minoan inscription from Tiryns: TIRY Avas 001",
    "authors": [
      "Brent Davis",
      "Joseph Maran",
      "Susanne Prillwitz",
      "Soňa Wirghová"
    ],
    "year": 2023,
    "url": "https://doi.org/10.1515/kadmos-2023-0001",
    "rights_note": "Open repository copy consulted; source-attributed factual/sign assertions only; figures not redistributed."
  },
  {
    "source_id": "vetters2011",
    "type": "article",
    "title": "A Clay Ball with a Cypro-Minoan Inscription from Tiryns",
    "authors": [
      "Melissa Vetters"
    ],
    "year": 2011,
    "url": "https://publications.dainst.org/journals/aa/article/download/99/4770",
    "rights_note": "Source-attributed factual metadata; no figures redistributed."
  },
  {
    "source_id": "bourogiannis2024",
    "type": "article",
    "title": "Contextualising Cypriot writing overseas: Cypro-Minoan and Cypro-Syllabic inscriptions found in Greece",
    "authors": [
      "Giorgos Bourogiannis"
    ],
    "year": 2024,
    "url": "https://www.researchgate.net/publication/384690092",
    "rights_note": "Bibliographic/contextual verification only; no figures redistributed."
  },
  {
    "source_id": "polig-donnelly2022",
    "type": "article",
    "title": "Between Frustration and Progress: An Integrated Cypro-Minoan Signary and Its Paleographic Diversity",
    "authors": [
      "Martina Polig",
      "Cassandra M. Donnelly"
    ],
    "year": 2022,
    "url": "https://nardecchiadigital.it/index.php?journal=SMEA-LERMA&op=view&page=article&path%5B%5D=2181",
    "rights_note": "Abstract-level signary metadata; no sign figures/database content redistributed."
  },
  {
    "source_id": "polig2022",
    "type": "thesis",
    "title": "3D Approaches to Cypro-Minoan Writing: Advanced 3D Methods of Documentation, Visualization and Analysis",
    "authors": [
      "Martina Polig"
    ],
    "year": 2022,
    "url": "https://hdl.handle.net/1854/LU-8749802",
    "rights_note": "Bibliographic/methodological metadata; thesis is in copyright with no general reuse license."
  },
  {
    "source_id": "donnelly2025-uncatalogued",
    "type": "article",
    "title": "Considering Three New Cypro-Minoan Inscriptions",
    "authors": [
      "Cassandra M. Donnelly"
    ],
    "year": 2025,